year,journal,count
2025,Driving Green Transportation System Through Artificial Intelligence and Automation,2
2025,Deep Learning in Ad-Hoc Wireless Networks,2
2025,Nature Reviews Bioengineering,2
2025,Marketing and Smart Technologies,2
2025,Automotive Innovation,2
2025,Measurement Techniques,2
2025,Applied Cognitive Computing and Artificial Intelligence,2
2025,Nature Reviews Psychology,2
2025,Artificial Intelligence,2
2025,Games and Learning Alliance,2
2025,Frontiers of Chemical Science and Engineering,2
2025,Journal of General Internal Medicine,2
2025,Journal of Patient-Reported Outcomes,2
2025,"Studies in Systems, Decision and Control",2
2025,Physics of Particles and Nuclei Letters,2
2025,Journal of The Institution of Engineers (India): Series B,2
2025,Annals of Data Science,2
2025,Flight Safety Management,2
2025,Zeitschrift für Arbeitswissenschaft,2
2025,Journal of Business Ethics,2
2025,Journal of Molecular Modeling,2
2025,Cartography,2
2025,MRS Communications,2
2025,Nature Reviews Electrical Engineering,2
2025,Cognition and Exploratory Learning in the Digital Age,2
2025,Creations,2
2025,AI Governance Handbook,2
2025,Environmental Chemistry Letters,2
2025,Global Philosophy,2
2025,Pharmaceutical Medicine,2
2025,Topoi,2
2025,Light: Science & Applications,2
2025,Cybernetics and Systems Analysis,2
2025,Human Centred Intelligent Systems,2
2025,"Signal and Information Processing, Networking and Computers",2
2025,Proceedings of Sixth International Conference on Computer and Communication Technologies,2
2025,npj Imaging,2
2025,Intelligent and Fuzzy Systems,2
2025,"The Political Economy of Contemporary Human Civilisation, Volume I",2
2025,KI - Künstliche Intelligenz,2
2025,Experimental & Molecular Medicine,2
2025,Discover Pharmaceutical Sciences,2
2025,Nature Reviews Cardiology,2
2025,Cancer Cell International,2
2025,Dermatology and Therapy,2
2025,The Political Economy of Long-term Planning,2
2025,"Machine Learning, Optimization, and Data Science",2
2025,npj Antimicrobials and Resistance,2
2025,The 18th International Conference Interdisciplinarity in Engineering,2
2025,Neural Processing Letters,2
2025,Holistic Integrative Oncology,2
2025,npj Drug Discovery,2
2025,Nature Human Behaviour,2
2025,New Players in Mobility,2
2025,Proceedings of 5th International Ethical Hacking Conference,2
2025,Human-Intelligent Systems Integration,2
2025,"Radiation Oncology – Principles, Precepts and Practice",2
2025,International Journal of Data Science and Analytics,2
2025,EAI/Springer Innovations in Communication and Computing,2
2025,Discover Global Society,2
2025,European Journal of Plastic Surgery,2
2025,Current Atherosclerosis Reports,2
2025,Journal of Neuro-Oncology,2
2025,The Dark Side of Marketing,2
2025,The Risk of Artificial Intelligence in Credit Ratings,2
2025,Artificial Intelligence in Government,2
2025,Annals of Surgical Oncology,2
2025,DET-2024: International Conference on Distance Education Technologies,2
2025,Current Food Science and Technology Reports,2
2025,Physical and Engineering Sciences in Medicine,2
2025,CardioVascular and Interventional Radiology,2
2025,Medical Ethics,2
2025,"Artificial Intelligence, Sustainable Technologies, and Business Innovation: Opportunities and Challenges of Digital Transformation",2
2025,Digital Technology Platforms and Deployment,2
2025,EcoHealth,2
2025,Journal of Echocardiography,2
2025,"Visual Computing for Industry, Biomedicine, and Art",2
2025,Navigating the Online Networks of Young Creators,2
2025,MRS Bulletin,2
2025,Deploying Artificial Intelligence to Achieve the UN Sustainable Development Goals,2
2025,Journal of Materials Engineering and Performance,2
2025,Automatic Control and Computer Sciences,2
2025,Archives of Sexual Behavior,2
2025,Next-Generation Computational Intelligence: Trends and Technologies,2
2025,A Practical Guide to Generative AI Using Amazon Bedrock,2
2025,Health Care Management Science,2
2025,Review of Managerial Science,2
2025,KN - Journal of Cartography and Geographic Information,2
2025,Handbook of Innovation,2
2025,Cognitive Computation,2
2025,Biomarker Research,2
2025,Artificial Intelligence and Soft Computing,2
2025,Rheumatology International,2
2025,Geotechnical and Geological Engineering,2
2025,Best Practices in Online Education,2
2025,Information and Communication Technologies in Tourism 2025,2
2025,"Multiscale and Multidisciplinary Modeling, Experiments and Design",2
2025,Discover Electrochemistry,2
2025,Journal of Materials Science,2
2025,BMC Ophthalmology,2
2025,Informatik Spektrum,2
2025,Journal of Translational Medicine,2
2025,Nature Biomedical Engineering,2
2025,The Palgrave Encyclopedia of Disability,2
2025,Artificial Intelligence-Aided Design for Sustainability,2
2025,IoT and Big Data Technologies for Health Care,2
2025,Nutrire,2
2025,"Critical Thinking Across Disciplines, Vol. 2",2
2025,Theory and Society,2
2025,Communications Earth & Environment,2
2025,Formal Methods in Architecture,2
2025,Bratislava Medical Journal,1
2025,Communications Medicine,1
2025,Journal of Religion and Health,1
2025,"Methodologies and Intelligent Systems for Technology Enhanced Learning, 15th International Conference",1
2025,Advanced Technologies and the University of the Future,1
2025,Journal of Cancer Education,1
2025,BDJ Open,1
2025,Disciplinary and Interdisciplinary Science Education Research,1
2025,Digital Education and Learning,1
2025,PROSPECTS,1
2025,"Leveraging Emerging Technologies and Analytics for Empowering Humanity, Vol. 2",1
2025,Intelligence-Driven Circular Economy,1
2025,Lecture Notes in Educational Technology,1
2025,The Political Economy of Robots,1
2025,Clinical Oral Investigations,1
2025,International Journal of Emergency Medicine,1
2025,Signals and Communication Technology,1
2025,Breast Cancer Research and Treatment,1
2025,Artificial Creativity,1
2025,Communications in Computer and Information Science,1
2025,"International Conference on Innovation, Sustainability, and Applied Sciences",1
2025,"Education, Equity, Economy",1
2025,15th International Scientific Conference on Distance Learning in Applied Informatics,1
2025,Egyptian Journal of Radiology and Nuclear Medicine,1
2025,"Design, Learning, and Innovation",1
2025,Big Data in Finance: Transforming the Financial Landscape,1
2025,Mathematics in Mind,1
2025,Voicing Responsible AI Pedagogy for Music and Visual Arts Education,1
2025,Journal of Medical Imaging and Interventional Radiology,1
2025,Blockchain and Machine Learning Innovations,1
2025,Agents and Artificial Intelligence,1
2025,Digital Transformation in Interdisciplinary Sciences,1
2025,The Cyber-Creativity Process,1
2025,Advances in Artificial Intelligence – IBERAMIA 2024,1
2025,Perspectives on Behavior Science,1
2025,Applied Innovations in Information and Communication Technology,1
2025,Emotional Data Applications and Regulation of Artificial Intelligence in Society,1
2025,Journal of Computer Science and Technology,1
2025,Innovative Higher Education,1
2025,Artificial Intelligence and the Future of Human Relations,1
2025,Innovative Computing and Communications,1
2025,Digital Management and Artificial Intelligence,1
2025,Reliability and Statistics in Transportation and Communication: Human Sustainability and Resilience in the Digital Age,1
2025,Innovation in Language Learning and Teaching,1
2025,Machine Learning and Principles and Practice of Knowledge Discovery in Databases,1
2025,Leading Smart Education,1
2025,Proceedings of International Conference on Information Technology and Applications,1
2025,Technology for Societal Transformation,1
2025,Advances in Information and Communication,1
2025,AI Ethics in Practice,1
2025,Advances in ICT Research in the Balkans,1
2025,"Intersection of Artificial Intelligence, Data Science, and Cutting-Edge Technologies: From Concepts to Applications in Smart Environment",1
2025,Intelligent Computing,1
2025,International Conference on Advanced Intelligent Systems for Sustainable Developent (AI2SD 2024),1
2025,Philosophical Studies,1
2025,2024 Yearbook Emerging Technologies in Learning,1
2025,Russian Engineering Research,1
2025,Dynamics of Translation Studies / Potenziale der Translationswissenschaft,1
2025,Advances in Artificial Intelligence in Education,1
2025,Human-Technology Interaction,1
2025,Intelligent Systems,1
2025,"The Egyptian Journal of Neurology, Psychiatry and Neurosurgery",1
2025,Revolution with Generative AI: Trends and Techniques,1
2025,Big Data – BigData 2025,1
2025,AI and IoT: Driving Business Success and sustainability in the Digital Age,1
2025,"ArtsIT, Interactivity and Game Creation",1
2025,Chinese Language Learning Sciences,1
2025,Transportation,1
2025,La radiologia medica,1
2025,Research in Chinese Education,1
2025,Adversarial Deep Generative Techniques for Early Diagnosis of Neurological Conditions and Mental Health Practises,1
2025,Biophysical Reviews,1
2025,Human Aspects of IT for the Aged Population,1
2025,Modern Practices and Trends in Expert Applications and Security,1
2025,Generative Artificial Intelligence and Fifth Industrial Revolution,1
2025,Journal of Technology in Behavioral Science,1
2025,Abdominal Radiology,1
2025,Japanese Journal of Radiology,1
2025,Discover Agriculture,1
2025,Human-Centric Intelligent Systems,1
2025,Artificial Intelligence for Design and Process Science,1
2025,AI-Assisted Assessment in Education,1
2025,Fudan Journal of the Humanities and Social Sciences,1
2025,Health Economics Review,1
2025,Current Anesthesiology Reports,1
2025,"Journal of Anesthesia, Analgesia and Critical Care",1
2025,Human-Centered AI: An Illustrated Scientific Quest,1
2025,Institutional guide to using AI for research,1
2025,Smart Computing Paradigms: Advanced Data Mining and Analytics,1
2025,Learning Technology for Education Challenges,1
2025,Acta Neurochirurgica,1
2025,BioNanoScience,1
2025,Cross-Cultural Design,1
2025,Unlocking Sustainable Wellbeing in the Digital Age,1
2025,Responsible AI in Practice,1
2025,Global Public Policy and Governance,1
2025,Artificial Life and Evolutionary Computation,1
2025,PharmacoEconomics - Open,1
2025,"Exploring Education Policy in a Globalized World: Concepts, Contexts, and Practices",1
2025,Artificial Intelligence over Infrared Images for Medical Applications,1
2025,"Artificial Intelligence, Pedagogy and Academic Integrity",1
2025,"Distributed Computing and Artificial Intelligence, 21st International Conference",1
2025,Nature Sustainability,1
2025,Herman Hollerith Conference 2024,1
2025,Urban Informatics,1
2025,Multivariate Analysis and Machine Learning Techniques,1
2025,Journal of International Entrepreneurship,1
2025,Current Cardiovascular Imaging Reports,1
2025,Using AI in Academic Writing and Research,1
2025,3 Biotech,1
2025,npj Soft Matter,1
2025,Data-centric Approaches to Industrial Decisions,1
2025,Proceedings of the 19th Latin American Conference on Learning Technologies (LACLO 2024),1
2025,Proceedings of the 3rd Vietnam Symposium on Advances in Offshore Engineering,1
2025,Artificial Intelligence in Surgery,1
2025,Food Engineering Reviews,1
2025,HCI International 2024 – Late Breaking Papers,1
2025,"Environment, Development and Sustainability",1
2025,Scientific and Technical Information Processing,1
2025,Clinical Rheumatology,1
2025,Advanced Topics in Electric Circuits,1
2025,Artificial Intelligence for Oral Health Care,1
2025,Nature Reviews Rheumatology,1
2025,Progress in Artificial Intelligence,1
2025,Smart Solutions for a Sustainable Future,1
2025,Journal of Clinical Psychology in Medical Settings,1
2025,AI Innovation in Real Estate,1
2025,Discover Cities,1
2025,International Journal of Speech Technology,1
2025,Generative AI with SAP and Amazon Bedrock,1
2025,5th International Conference for Innovation in Biomedical Engineering and Life Sciences,1
2025,Anesthesiology and Perioperative Science,1
2025,Quantum Computing and Quantum Machine Learning for Engineers and Developers,1
2025,International Journal of Machine Learning and Cybernetics,1
2025,Neural Computing and Applications,1
2025,Bio-Design and Manufacturing,1
2025,Italian Journal of Marketing,1
2025,EURASIP Journal on Information Security,1
2025,International Journal of Precision Engineering and Manufacturing-Green Technology,1
2025,Networks and Sustainability,1
2025,Global Journal of Flexible Systems Management,1
2025,neuropsychiatrie,1
2025,Biological Invasions,1
2025,The Science of Nature,1
2025,Electrochemical Energy Reviews,1
2025,"Virtual, Augmented and Mixed Reality",1
2025,Clinical and Translational Oncology,1
2025,Nature Reviews Urology,1
2025,Discover Chemical Engineering,1
2025,Nature Climate Change,1
2025,Automated Software Engineering,1
2025,The International Journal of Advanced Manufacturing Technology,1
2025,European Journal of Medical Research,1
2025,Clinical Child and Family Psychology Review,1
2025,Knee Surgery & Related Research,1
2025,Rethinking Retail,1
2025,AMS Review,1
2025,JMST Advances,1
2025,"Service Oriented, Holonic and Multi-agent Manufacturing Systems for Industry of the Future",1
2025,Asian-Pacific Journal of Second and Foreign Language Education,1
2025,Systems Engineering & Management,1
2025,"Cognition, Technology & Work",1
2025,International Journal of Computational Intelligence Systems,1
2025,Adaptive Instructional Systems,1
2025,Journal of Fluorescence,1
2025,E-Learning and Enhancing Soft Skills,1
2025,Cognitive Therapy and Research,1
2026,Two Decades of TEL. From Lessons Learnt to Challenges Ahead,14
2026,Innovative Technologies and Learning,10
2026,Ethical and Social Impacts of Information and Communication Technology,9
2026,Lecture Notes in Networks and Systems,5
2026,Smart Trends in Computing and Communications,4
2026,"Informatics in Schools. Fostering Problem-Solving, Creativity, and Critical Thinking Through Computer Science Education",4
2026,Lecture Notes in Computer Science,4
2026,Artificial Media,3
2026,Extended Reality,3
2026,Generative Systems and Intelligent Tutoring Systems,3
2026,Texts & Monographs in Symbolic Computation,3
2026,unknown,2
2026,Computer Science – CACIC 2024,2
2026,"Analysis of Images, Social Networks and Texts",2
2026,AI for Clinical Applications,2
2026,Computational Science and Its Applications – ICCSA 2025 Workshops,2
2026,"Systems, Software and Services Process Improvement",2
2026,Bridging the Gap Between AI and Reality,2
2026,Artificial Intelligence in Business,2
2026,Progress in Optical Science and Photonics,2
2026,Human-Computer Interaction – INTERACT 2025,2
2026,Hybrid Human-AI Collaborative Networks,2
2026,Sports Analytics,1
2026,"Digital Transformation in Achieving Sustainable Development of Management, Economic, and Applied Sciences",1
2026,Integrating Big Data and IoT for Enhanced Decision-Making Systems in Business,1
2026,Research and Innovation Forum 2024,1
2026,Digital Education: Shaping Sustainable Lifelong Learning for All in the Era of AI,1
2026,Industrial Engineering and Operations Management,1
2026,Cloud Computing,1
2026,Flexible Query Answering Systems,1
2026,Manufacturing 2030 - A Perspective to Future Challenges in Industrial Production,1
2026,"Exploring Education Policy in a Globalized World: Concepts, Contexts, and Practices",1
2026,Digital Interaction and Machine Intelligence,1
2026,Progress in Artificial Intelligence,1
2026,"Connected Objects, Artificial Intelligence, Telecommunications and Electronics Engineering",1
2026,Electronic Participation,1
2026,Digital Transformation in Education and Artificial Intelligence Application,1
2026,Software Engineering: Emerging Trends and Practices in System Development,1
2027,unknown,1
